onset	duration	trial_type	value	stim_file	statement_text
1359.368	4.195441423444693	PVV/Agema/right/positive/Vegetarianism	112	PVV_Agema.jpg	Vier traditie, vlees op de grill
1363.352	4.076992600017925	GL/Timmermans/left/positive/Vegetarianism	70	GL_Timmermans.jpg	Kies gezond, eet minder vlees
1371.208	3.798475003215292	GL/Timmermans/right/positive/Immigration	74	GL_Timmermans.jpg	Nederlanders eerst, niet migranten
1375.012	3.9051999286678956	GL/Klaver/right/negative/Gender equality	13	GL_Klaver.jpg	Zwakke families, zwakke samenleving
1382.92	4.145419288801163	PVV/Wilders/left/positive/Immigration	140	PVV_Wilders.jpg	Een warm welkom voor vluchtelingen
1390.64	3.742021417591615	PVV/Agema/left/neutral/EU	90	PVV_Agema.jpg	Versterk de Europese basis
1394.96	3.7502428358416666	PVV/Wilders/left/negative/Immigration	116	PVV_Wilders.jpg	Stop onrecht tegen vluchtelingen
1399.496	3.4327696179819096	GL/Klaver/left/neutral/Climate	17	GL_Klaver.jpg	Stop klimaatverandering
1403.616	4.108910419051284	PVV/Wilders/right/positive/Vegetarianism	148	PVV_Wilders.jpg	Een sterkere natie met vlees
1407.304	3.595827117884639	PVV/Agema/right/positive/Integration	111	PVV_Agema.jpg	Koester Nederlandse waarden
1415.728	3.830181884434866	PVV/Wilders/right/positive/Climate	143	PVV_Wilders.jpg	Klimaatverandering? Niet zo ernstig
1419.812	4.063126806197158	GL/Timmermans/left/negative/Integration	45	GL_Timmermans.jpg	Beëindig de bekrompen culturele integratie
1424.068	4.256997027206676	PVV/Agema/right/neutral/Vegetarianism	100	PVV_Agema.jpg	Geen restricties, biefstuk op de grill
1427.704	3.6419305655468883	PVV/Wilders/right/neutral/EU	132	PVV_Wilders.jpg	Eigen land eerst
1435.76	3.7742287766149123	PVV/Wilders/right/neutral/Immigration	134	PVV_Wilders.jpg	Grenzen dicht voor immigranten
1439.444	3.742021417591615	PVV/Agema/left/neutral/EU	90	PVV_Agema.jpg	Versterk de Europese basis
1443.048	3.6089533586714264	PVV/Wilders/right/neutral/Climate	131	PVV_Wilders.jpg	Klimaatverandering? Niet bewezen
1446.852	4.032881405374804	GL/Timmermans/right/neutral/Immigration	62	GL_Timmermans.jpg	Stop immigranten aan de grens
