onset	duration	trial_type	value	stim_file	statement_text
5.596	0.0	n/a	3	n/a	n/a
9.38	0.0	n/a	3	n/a	n/a
16.588	0.0	n/a	3	n/a	n/a
25.98	0.0	n/a	3	n/a	n/a
38.62	0.0	n/a	3	n/a	n/a
52.732	0.0	n/a	3	n/a	n/a
60.256	0.0	n/a	3	n/a	n/a
69.496	3.759354940854588	PVV/Agema/left/negative/Integration	81	PVV_Agema.jpg	Integratie eisen is racisme.
73.88	4.538095802485606	GL/Timmermans/left/negative/Climate	41	GL_Timmermans.jpg	Onze kinderen hebben geen toekomst, stop klimaatverandering
78.2	4.16965605290796	GL/Klaver/left/positive/EU	30	GL_Klaver.jpg	Meer Europa voor een vreedzame toekomst
86.156	4.032881405374804	GL/Timmermans/right/neutral/Immigration	62	GL_Timmermans.jpg	Stop immigranten aan de grens
89.976	3.7742287766149123	PVV/Wilders/right/neutral/Immigration	134	PVV_Wilders.jpg	Grenzen dicht voor immigranten
98.584	4.589727818363813	PVV/Wilders/right/positive/Gender equality	145	PVV_Wilders.jpg	Het Gezin als hoeksteen, voor een stralende toekomst
106.756	4.230124730681888	PVV/Agema/left/negative/Immigration	80	PVV_Agema.jpg	Stop de slechte behandeling van vluchtelingen
110.976	4.216591806771572	GL/Timmermans/left/negative/Immigration	44	GL_Timmermans.jpg	Stop de slechte opvang van vluchtelingen
118.784	3.851652104113501	GL/Klaver/left/negative/Integration	9	GL_Klaver.jpg	Stop bevooroordeelde culturele integratie
122.42	3.551176380137438	PVV/Agema/left/neutral/Immigration	92	PVV_Agema.jpg	Vang vluchtelingen op
126.388	4.146676446249187	PVV/Wilders/right/negative/EU	120	PVV_Wilders.jpg	Stap uit de totalitaire EU
130.524	3.989338941076143	GL/Klaver/left/negative/Climate	5	GL_Klaver.jpg	Klimaatverandering neemt onze toekomst weg
134.096	3.591447738441374	GL/Timmermans/left/neutral/Gender equality	55	GL_Timmermans.jpg	Meer gender gelijkheid
142.3	4.28579018312096	PVV/Wilders/left/positive/Climate	137	PVV_Wilders.jpg	Voor een zonnige toekomst, stop klimaatverandering
146.388	3.9839003421187105	GL/Timmermans/right/positive/Climate	71	GL_Timmermans.jpg	Ontspan, klimaatverandering is een grap
150.192	3.8533276095771765	GL/Klaver/right/positive/Climate	35	GL_Klaver.jpg	Warmer klimaat, warmere stranden
154.46	4.351622068101192	GL/Klaver/right/negative/Vegetarianism	16	GL_Klaver.jpg	Negeer de gekkies, eet een burger
158.396	3.833962940247254	GL/Timmermans/right/negative/Climate	47	GL_Timmermans.jpg	Klimaatverandering is een complot
165.82	3.4327696179819096	GL/Klaver/left/neutral/Climate	17	GL_Klaver.jpg	Stop klimaatverandering
169.472	3.6698542314669753	PVV/Wilders/right/positive/Integration	147	PVV_Wilders.jpg	Nederlandse waarden eerst
173.144	3.7260289802572437	PVV/Agema/left/neutral/Vegetarianism	94	PVV_Agema.jpg	Eet minder vlees
177.912	4.623537387032819	GL/Timmermans/left/negative/Gender equality	43	GL_Timmermans.jpg	Verzet je tegen de norm, meer gender gelijkheid
181.9	4.038128650379418	GL/Timmermans/left/positive/Immigration	68	GL_Timmermans.jpg	Een warm welkom voor vluchtelingen
186.352	4.459256725517901	PVV/Agema/right/positive/EU	108	PVV_Agema.jpg	Maak ons rijker, weg uit de EU
190.388	4.096601276207772	GL/Timmermans/right/neutral/Vegetarianism	64	GL_Timmermans.jpg	Een Hamburger voor elke burger
194.06	3.5737827463029106	PVV/Wilders/right/negative/Integration	123	PVV_Wilders.jpg	Integreren of vertrekken
202.032	3.992956454828632	PVV/Agema/right/neutral/EU	96	PVV_Agema.jpg	Nederland moet uit de EU
210.236	3.7742287766149123	PVV/Wilders/right/neutral/Immigration	134	PVV_Wilders.jpg	Grenzen dicht voor immigranten
218.312	4.1498617938906355	PVV/Agema/right/neutral/Immigration	98	PVV_Agema.jpg	Geen toegang voor illegale immigranten
222.248	3.7882606374754433	GL/Klaver/right/neutral/Immigration	26	GL_Klaver.jpg	Immigranten stoppen, grenzen bewaken
225.832	3.6459496461224092	GL/Timmermans/left/neutral/EU	54	GL_Timmermans.jpg	Meer Europese integratie
230.088	4.181454731131796	PVV/Agema/right/negative/Vegetarianism	88	PVV_Agema.jpg	Weg met moralisme, vlees is beter
234.272	4.256936465724646	PVV/Agema/left/positive/EU	102	PVV_Agema.jpg	Europa zorgt voor vrede in Europa
242.748	3.8533276095771765	GL/Klaver/right/positive/Climate	35	GL_Klaver.jpg	Warmer klimaat, warmere stranden
246.332	3.691382230475414	PVV/Agema/right/neutral/Climate	95	PVV_Agema.jpg	Klimaatverandering bestaat niet
250.436	4.038128650379418	GL/Timmermans/left/positive/Immigration	68	GL_Timmermans.jpg	Een warm welkom voor vluchtelingen
254.556	3.8533276095771765	GL/Klaver/right/positive/Climate	35	GL_Klaver.jpg	Warmer klimaat, warmere stranden
258.308	4.038128650379418	GL/Timmermans/left/positive/Immigration	68	GL_Timmermans.jpg	Een warm welkom voor vluchtelingen
262.096	3.830181884434866	PVV/Wilders/right/positive/Climate	143	PVV_Wilders.jpg	Klimaatverandering? Niet zo ernstig
266.148	4.032881405374804	GL/Timmermans/right/neutral/Immigration	62	GL_Timmermans.jpg	Stop immigranten aan de grens
269.768	3.5656212554833653	GL/Klaver/right/positive/Integration	39	GL_Klaver.jpg	Bewaar Nederlandse identiteit
277.54	3.7633511578434886	GL/Klaver/right/negative/Integration	15	GL_Klaver.jpg	Integreer of ga terug
281.292	3.8122525534751173	GL/Timmermans/right/negative/Immigration	50	GL_Timmermans.jpg	Deporteer nu alle immigranten
285.096	3.7742287766149123	PVV/Wilders/right/neutral/Immigration	134	PVV_Wilders.jpg	Grenzen dicht voor immigranten
288.932	3.790532264789158	GL/Timmermans/right/positive/Gender equality	73	GL_Timmermans.jpg	Het gezin is heilig
292.72	3.866488740926653	GL/Timmermans/right/negative/EU	48	GL_Timmermans.jpg	Ontsnap uit de EU-fuik
296.588	3.8927225195694373	PVV/Agema/left/positive/Immigration	104	PVV_Agema.jpg	Wees gastvrij naar vluchtelingen
305.112	4.538095802485606	GL/Timmermans/left/negative/Climate	41	GL_Timmermans.jpg	Onze kinderen hebben geen toekomst, stop klimaatverandering
309.132	3.9583526684340784	GL/Timmermans/left/neutral/Climate	53	GL_Timmermans.jpg	Tijd om klimaatverandering te stoppen
312.868	3.897682841943392	GL/Klaver/right/neutral/Climate	23	GL_Klaver.jpg	Klimaatverandering is niet echt
321.192	4.275646012877995	PVV/Agema/right/negative/Gender equality	85	PVV_Agema.jpg	Stop bedreigingen tegen het traditionele gezin
329.464	4.038128650379418	GL/Timmermans/left/positive/Immigration	68	GL_Timmermans.jpg	Een warm welkom voor vluchtelingen
337.988	3.4327696179819096	GL/Klaver/left/neutral/Climate	17	GL_Klaver.jpg	Stop klimaatverandering
341.856	4.538095802485606	GL/Timmermans/left/negative/Climate	41	GL_Timmermans.jpg	Onze kinderen hebben geen toekomst, stop klimaatverandering
350.18	3.7742287766149123	PVV/Wilders/right/neutral/Immigration	134	PVV_Wilders.jpg	Grenzen dicht voor immigranten
354.368	4.247424293795811	GL/Klaver/left/positive/Gender equality	31	GL_Klaver.jpg	Met krachtige vrouwen, een rijkere maatschappij
358.004	3.711334894316796	GL/Klaver/right/neutral/Gender equality	25	GL_Klaver.jpg	Bescherm het gezin
362.124	3.989338941076143	GL/Klaver/left/negative/Climate	5	GL_Klaver.jpg	Klimaatverandering neemt onze toekomst weg
366.092	3.759354940854588	PVV/Agema/left/negative/Integration	81	PVV_Agema.jpg	Integratie eisen is racisme.
370.528	4.490128189283872	PVV/Wilders/left/negative/Vegetarianism	118	PVV_Wilders.jpg	De Aarde gaat kapot, eet minder vlees.
374.6	4.066215891666008	PVV/Agema/left/positive/Climate	101	PVV_Agema.jpg	Stop klimaatverandering, red de wereld
379.084	4.478242339953799	GL/Timmermans/right/neutral/Gender equality	61	GL_Timmermans.jpg	Het gezin als hoeksteen van de samenleving
382.924	3.8146539753174515	PVV/Agema/left/neutral/Climate	89	PVV_Agema.jpg	We moeten klimaatverandering stoppen
386.96	3.830181884434866	PVV/Wilders/right/positive/Climate	143	PVV_Wilders.jpg	Klimaatverandering? Niet zo ernstig
394.664	3.5808937043502205	PVV/Wilders/left/neutral/EU	126	PVV_Wilders.jpg	Versterk Europese eenheid
398.452	3.9286431427984017	PVV/Wilders/left/positive/Gender equality	139	PVV_Wilders.jpg	Positieve discriminatie voor vrouwen
406.376	3.830181884434866	PVV/Wilders/right/positive/Climate	143	PVV_Wilders.jpg	Klimaatverandering? Niet zo ernstig
414.48	4.032881405374804	GL/Timmermans/right/neutral/Immigration	62	GL_Timmermans.jpg	Stop immigranten aan de grens
418.416	3.8267833432375125	PVV/Wilders/left/negative/Gender equality	115	PVV_Wilders.jpg	Werp het patriarchaat omver
422.036	3.5536976827035485	PVV/Agema/left/neutral/Integration	93	PVV_Agema.jpg	Respecteer culturele verschillen
425.588	3.726969674251033	PVV/Wilders/left/neutral/Gender equality	127	PVV_Wilders.jpg	Bevorder gender gelijkheid
433.928	3.7260289802572437	PVV/Agema/left/neutral/Vegetarianism	94	PVV_Agema.jpg	Eet minder vlees
438.0	3.9926523874595614	PVV/Agema/right/negative/Immigration	86	PVV_Agema.jpg	Weg ermee, geen immigranten toelaten
441.984	3.9754935732219336	GL/Klaver/right/positive/Gender equality	37	GL_Klaver.jpg	Put kracht uit het gezin
445.736	3.7502428358416666	PVV/Wilders/left/negative/Immigration	116	PVV_Wilders.jpg	Stop onrecht tegen vluchtelingen
449.072	3.3858261624934247	PVV/Agema/left/negative/Gender equality	79	PVV_Agema.jpg	Stop vrouwenonderdrukking
457.096	4.145419288801163	PVV/Wilders/left/positive/Immigration	140	PVV_Wilders.jpg	Een warm welkom voor vluchtelingen
465.02	3.8063324668648137	PVV/Agema/right/negative/Climate	83	PVV_Agema.jpg	Klimaatverandering is een illusie
468.624	3.595827117884639	PVV/Agema/right/positive/Integration	111	PVV_Agema.jpg	Koester Nederlandse waarden
473.044	3.989338941076143	GL/Klaver/left/negative/Climate	5	GL_Klaver.jpg	Klimaatverandering neemt onze toekomst weg
543.932	3.9839003421187105	GL/Timmermans/right/positive/Climate	71	GL_Timmermans.jpg	Ontspan, klimaatverandering is een grap
547.952	3.7260289802572437	PVV/Agema/left/neutral/Vegetarianism	94	PVV_Agema.jpg	Eet minder vlees
551.856	3.7742287766149123	PVV/Wilders/right/neutral/Immigration	134	PVV_Wilders.jpg	Grenzen dicht voor immigranten
559.692	3.9279506931155366	GL/Klaver/left/neutral/Gender equality	19	GL_Klaver.jpg	Maak ruimte voor vrouwen
564.032	4.222697807905786	GL/Klaver/left/positive/Vegetarianism	34	GL_Klaver.jpg	Red de wereld, eet minder vlees.
572.052	4.032881405374804	GL/Timmermans/right/neutral/Immigration	62	GL_Timmermans.jpg	Stop immigranten aan de grens
579.708	3.595827117884639	PVV/Agema/right/positive/Integration	111	PVV_Agema.jpg	Koester Nederlandse waarden
583.612	3.7779247436105416	GL/Timmermans/right/positive/Vegetarianism	76	GL_Timmermans.jpg	Echte Nederlanders eten vlees
591.8	4.270412855511583	PVV/Agema/left/negative/EU	78	PVV_Agema.jpg	Meer Europa in deze gevaarlijke wereld
599.876	3.7260289802572437	PVV/Agema/left/neutral/Vegetarianism	94	PVV_Agema.jpg	Eet minder vlees
603.696	3.7502428358416666	PVV/Wilders/left/negative/Immigration	116	PVV_Wilders.jpg	Stop onrecht tegen vluchtelingen
607.996	3.7502428358416666	PVV/Wilders/left/negative/Immigration	116	PVV_Wilders.jpg	Stop onrecht tegen vluchtelingen
616.272	3.7260289802572437	PVV/Agema/left/neutral/Vegetarianism	94	PVV_Agema.jpg	Eet minder vlees
619.956	3.5992122701363964	PVV/Wilders/left/neutral/Vegetarianism	130	PVV_Wilders.jpg	Eet minder vlees
624.176	4.192245229305358	GL/Klaver/right/negative/Immigration	14	GL_Klaver.jpg	Verwijder immigranten voor eens en altijd
627.748	3.897682841943392	GL/Klaver/right/neutral/Climate	23	GL_Klaver.jpg	Klimaatverandering is niet echt
631.948	4.183085646174609	GL/Klaver/right/neutral/Vegetarianism	28	GL_Klaver.jpg	Iedereen vlees, het is gewoon eten
635.936	4.090495336413179	GL/Timmermans/right/negative/Gender equality	49	GL_Timmermans.jpg	Geen moderne fratsen, herbevestig familiewaarden
644.644	4.5925612010959815	PVV/Agema/left/negative/Vegetarianism	82	PVV_Agema.jpg	Minder vlees is minder schade aan de natuur
648.812	3.7502428358416666	PVV/Wilders/left/negative/Immigration	116	PVV_Wilders.jpg	Stop onrecht tegen vluchtelingen
652.784	3.971623971006909	PVV/Wilders/left/negative/Integration	117	PVV_Wilders.jpg	Minder integratie, het is racisme
660.32	3.5550179859297764	PVV/Wilders/right/negative/Climate	119	PVV_Wilders.jpg	Klimaatverandering is onzin
664.308	4.538095802485606	GL/Timmermans/left/negative/Climate	41	GL_Timmermans.jpg	Onze kinderen hebben geen toekomst, stop klimaatverandering
668.128	3.595827117884639	PVV/Agema/right/positive/Integration	111	PVV_Agema.jpg	Koester Nederlandse waarden
671.864	3.8283340868312776	GL/Timmermans/left/positive/Climate	65	GL_Timmermans.jpg	Samen sterk tegen klimaatverandering
680.104	4.256936465724646	PVV/Agema/left/positive/EU	102	PVV_Agema.jpg	Europa zorgt voor vrede in Europa
688.128	4.0569803047692155	GL/Timmermans/right/positive/EU	72	GL_Timmermans.jpg	Nederland rijker zonder de EU
692.396	4.288984315063538	GL/Timmermans/right/negative/Vegetarianism	52	GL_Timmermans.jpg	Weg met soja, vlees is koning
700.904	3.989338941076143	GL/Klaver/left/negative/Climate	5	GL_Klaver.jpg	Klimaatverandering neemt onze toekomst weg
708.744	4.032881405374804	GL/Timmermans/right/neutral/Immigration	62	GL_Timmermans.jpg	Stop immigranten aan de grens
712.912	3.7742287766149123	PVV/Wilders/right/neutral/Immigration	134	PVV_Wilders.jpg	Grenzen dicht voor immigranten
717.116	4.313223982769591	PVV/Agema/left/positive/Vegetarianism	106	PVV_Agema.jpg	Een groener bord, een beter wereld
721.42	4.171845084901502	GL/Timmermans/left/positive/EU	66	GL_Timmermans.jpg	Straal vertrouwen uit, geef Europa vleugels
725.172	3.7466602560376843	GL/Klaver/left/positive/Climate	29	GL_Klaver.jpg	Leefbaar leven, stop klimaatverandering
729.124	4.038128650379418	GL/Timmermans/left/positive/Immigration	68	GL_Timmermans.jpg	Een warm welkom voor vluchtelingen
733.196	3.7742287766149123	PVV/Wilders/right/neutral/Immigration	134	PVV_Wilders.jpg	Grenzen dicht voor immigranten
737.064	3.4327696179819096	GL/Klaver/left/neutral/Climate	17	GL_Klaver.jpg	Stop klimaatverandering
740.92	3.8410502306837957	PVV/Agema/right/positive/Immigration	110	PVV_Agema.jpg	Stel Nederlanders boven migranten
744.972	3.9858663083819694	PVV/Agema/right/positive/Gender equality	109	PVV_Agema.jpg	Het traditionele gezin versterkt ons
752.744	4.538095802485606	GL/Timmermans/left/negative/Climate	41	GL_Timmermans.jpg	Onze kinderen hebben geen toekomst, stop klimaatverandering
756.48	3.8045059913418626	GL/Timmermans/right/neutral/Climate	59	GL_Timmermans.jpg	Er is geen klimaatverandering
764.504	4.1171779662769215	PVV/Wilders/left/positive/Integration	141	PVV_Wilders.jpg	Culturele verschillen maken ons sterker
768.624	3.989338941076143	GL/Klaver/left/negative/Climate	5	GL_Klaver.jpg	Klimaatverandering neemt onze toekomst weg
772.892	4.203509020668138	GL/Klaver/left/neutral/EU	18	GL_Klaver.jpg	Bied stabiliteit, zet Europese koers voort
777.312	4.538095802485606	GL/Timmermans/left/negative/Climate	41	GL_Timmermans.jpg	Onze kinderen hebben geen toekomst, stop klimaatverandering
781.416	3.8533276095771765	GL/Klaver/right/positive/Climate	35	GL_Klaver.jpg	Warmer klimaat, warmere stranden
785.304	3.879159549640091	GL/Timmermans/right/negative/Integration	51	GL_Timmermans.jpg	Geen ruimte voor diversiteit
793.176	3.8533276095771765	GL/Klaver/right/positive/Climate	35	GL_Klaver.jpg	Warmer klimaat, warmere stranden
797.46	4.347989056011844	PVV/Wilders/right/negative/Vegetarianism	124	PVV_Wilders.jpg	Voel je niet schuldig, eet vlees
801.4	4.145419288801163	PVV/Wilders/left/positive/Immigration	140	PVV_Wilders.jpg	Een warm welkom voor vluchtelingen
809.688	3.7260289802572437	PVV/Agema/left/neutral/Vegetarianism	94	PVV_Agema.jpg	Eet minder vlees
817.912	4.275646012877995	PVV/Agema/right/negative/Gender equality	85	PVV_Agema.jpg	Stop bedreigingen tegen het traditionele gezin
826.168	4.281515941560392	GL/Timmermans/left/negative/Vegetarianism	46	GL_Timmermans.jpg	Sluit je ogen niet voor dierenleed
830.02	3.7672123282441974	PVV/Agema/right/neutral/Gender equality	97	PVV_Agema.jpg	Voor een stabiel gezin
838.012	4.113118154248649	PVV/Wilders/right/neutral/Integration	135	PVV_Wilders.jpg	De multiculturele samenleving is mislukt
846.116	4.113154902000769	PVV/Wilders/right/positive/Immigration	146	PVV_Wilders.jpg	Eer onze mensen, weiger immigratie
849.584	3.4568325724843882	PVV/Wilders/left/neutral/Climate	125	PVV_Wilders.jpg	Stop klimaatverandering
853.456	3.877755686751971	GL/Klaver/left/neutral/Immigration	20	GL_Klaver.jpg	Geef onderdak aan vluchtelingen
857.324	4.038128650379418	GL/Timmermans/left/positive/Immigration	68	GL_Timmermans.jpg	Een warm welkom voor vluchtelingen
861.46	4.113098100859007	PVV/Agema/right/positive/Climate	107	PVV_Agema.jpg	Ontspan, klimaatverandering is een grap
865.148	3.6340177011611714	GL/Klaver/left/neutral/Integration	21	GL_Klaver.jpg	Respecteer alle culturen
869.2	3.989338941076143	GL/Klaver/left/negative/Climate	5	GL_Klaver.jpg	Klimaatverandering neemt onze toekomst weg
873.572	4.507410938498979	GL/Klaver/left/negative/Vegetarianism	10	GL_Klaver.jpg	Hou de aarde heel, schrap dierlijke producten
877.44	3.7742287766149123	PVV/Wilders/right/neutral/Immigration	134	PVV_Wilders.jpg	Grenzen dicht voor immigranten
885.68	4.299568380273488	GL/Timmermans/right/neutral/EU	60	GL_Timmermans.jpg	Blijf onafhankelijk, zet EU op afstand
889.784	3.4327696179819096	GL/Klaver/left/neutral/Climate	17	GL_Klaver.jpg	Stop klimaatverandering
897.708	3.8738778218308143	GL/Klaver/right/positive/Immigration	38	GL_Klaver.jpg	Onze mensen boven immigratie
905.996	4.279952436601784	PVV/Wilders/left/positive/EU	138	PVV_Wilders.jpg	Bundel de kracht van de EU
910.268	3.7502428358416666	PVV/Wilders/left/negative/Immigration	116	PVV_Wilders.jpg	Stop onrecht tegen vluchtelingen
913.884	3.595827117884639	PVV/Agema/right/positive/Integration	111	PVV_Agema.jpg	Koester Nederlandse waarden
917.772	3.897682841943392	GL/Klaver/right/neutral/Climate	23	GL_Klaver.jpg	Klimaatverandering is niet echt
925.68	3.7730600252989888	GL/Klaver/left/negative/Gender equality	7	GL_Klaver.jpg	Doorbreek stilte, eis genderbalans
929.664	4.08656635497512	PVV/Agema/right/negative/Integration	87	PVV_Agema.jpg	Eis aanpassing, hou cultuur zuiver
933.536	3.924778881345256	GL/Klaver/right/neutral/EU	24	GL_Klaver.jpg	Uit de EU, nu
937.672	4.116975900029511	PVV/Agema/right/neutral/Integration	99	PVV_Agema.jpg	De multiculturele samenleving heeft gefaald
941.992	4.256936465724646	PVV/Agema/left/positive/EU	102	PVV_Agema.jpg	Europa zorgt voor vrede in Europa
949.916	3.814153092396743	PVV/Wilders/right/negative/Immigration	122	PVV_Wilders.jpg	Immigranten eruit, geen uitzonderingen
953.932	4.275646012877995	PVV/Agema/right/negative/Gender equality	85	PVV_Agema.jpg	Stop bedreigingen tegen het traditionele gezin
957.636	3.565979593932667	GL/Timmermans/right/positive/Integration	75	GL_Timmermans.jpg	Bewaar Nederlandse identiteit
965.408	3.8062077876037512	PVV/Wilders/left/neutral/Integration	129	PVV_Wilders.jpg	Bouw bruggen tussen culturen
1034.148	4.145419288801163	PVV/Wilders/left/positive/Immigration	140	PVV_Wilders.jpg	Een warm welkom voor vluchtelingen
1037.764	3.580565543859787	GL/Timmermans/left/neutral/Integration	57	GL_Timmermans.jpg	Omarm culturele verschillen
1041.352	3.595827117884639	PVV/Agema/right/positive/Integration	111	PVV_Agema.jpg	Koester Nederlandse waarden
1045.772	3.989338941076143	GL/Klaver/left/negative/Climate	5	GL_Klaver.jpg	Klimaatverandering neemt onze toekomst weg
1049.76	3.9675065967512015	GL/Timmermans/left/positive/Gender equality	67	GL_Timmermans.jpg	Gendergelijkheid voor een betere wereld
1057.732	3.8122525534751173	GL/Timmermans/right/negative/Immigration	50	GL_Timmermans.jpg	Deporteer nu alle immigranten
1065.804	4.063295179425075	PVV/Wilders/right/positive/EU	144	PVV_Wilders.jpg	Minder EU, meer economische vrijheid
1069.856	4.092732831963274	PVV/Wilders/left/negative/EU	114	PVV_Wilders.jpg	Europese saamhorigheid, of oorlog wacht
1077.932	4.027514476871962	GL/Klaver/right/positive/EU	36	GL_Klaver.jpg	Vrijhandel, weg met de EU
1081.752	3.809579071739032	GL/Timmermans/left/neutral/Immigration	56	GL_Timmermans.jpg	Bied onderdak aan ontheemden
1085.552	3.856210955706868	PVV/Agema/left/positive/Gender equality	103	PVV_Agema.jpg	Meer autonomie voor vrouwen
1089.624	4.014399271876683	PVV/Wilders/right/neutral/Vegetarianism	136	PVV_Wilders.jpg	Geen gedoe, blijf vlees serveren
1093.844	4.302388980958743	PVV/Agema/right/negative/EU	84	PVV_Agema.jpg	Eis onze vrijheid van de EU
1101.732	3.9839003421187105	GL/Timmermans/right/positive/Climate	71	GL_Timmermans.jpg	Ontspan, klimaatverandering is een grap
1105.552	3.7502428358416666	PVV/Wilders/left/negative/Immigration	116	PVV_Wilders.jpg	Stop onrecht tegen vluchtelingen
1109.788	4.181454731131796	PVV/Agema/right/negative/Vegetarianism	88	PVV_Agema.jpg	Weg met moralisme, vlees is beter
1113.524	3.864129628994675	PVV/Wilders/left/neutral/Immigration	128	PVV_Wilders.jpg	Verleen hulp, steun vluchtelingen
1117.612	4.132383281439381	GL/Klaver/left/neutral/Vegetarianism	22	GL_Klaver.jpg	Bespaar wat vlees, probeer alternatieven
1125.536	4.275646012877995	PVV/Agema/right/negative/Gender equality	85	PVV_Agema.jpg	Stop bedreigingen tegen het traditionele gezin
1129.336	3.820626441693748	GL/Klaver/right/negative/EU	12	GL_Klaver.jpg	Stop de EU dictatuur
1132.956	3.897682841943392	GL/Klaver/right/neutral/Climate	23	GL_Klaver.jpg	Klimaatverandering is niet echt
1136.76	3.989338941076143	GL/Klaver/left/negative/Climate	5	GL_Klaver.jpg	Klimaatverandering neemt onze toekomst weg
1145.064	4.275646012877995	PVV/Agema/right/negative/Gender equality	85	PVV_Agema.jpg	Stop bedreigingen tegen het traditionele gezin
1148.868	3.897682841943392	GL/Klaver/right/neutral/Climate	23	GL_Klaver.jpg	Klimaatverandering is niet echt
1152.856	4.100966016271225	PVV/Wilders/right/negative/Gender equality	121	PVV_Wilders.jpg	Geen moderne fratsen, herbevestig familiewaarden
1157.376	3.830181884434866	PVV/Wilders/right/positive/Climate	143	PVV_Wilders.jpg	Klimaatverandering? Niet zo ernstig
1165.38	4.070075750278132	GL/Timmermans/left/neutral/Vegetarianism	58	GL_Timmermans.jpg	Stel grenzen, eet vlees bewust
1173.256	3.7502428358416666	PVV/Wilders/left/negative/Immigration	116	PVV_Wilders.jpg	Stop onrecht tegen vluchtelingen
1180.96	3.5606480984349513	PVV/Wilders/right/neutral/Gender equality	133	PVV_Wilders.jpg	Zet familiewaarden voorop
1184.948	3.8533276095771765	GL/Klaver/right/positive/Climate	35	GL_Klaver.jpg	Warmer klimaat, warmere stranden
1188.752	3.8533276095771765	GL/Klaver/right/positive/Climate	35	GL_Klaver.jpg	Warmer klimaat, warmere stranden
1196.624	3.749233620433536	GL/Klaver/right/negative/Climate	11	GL_Klaver.jpg	Klimaatverandering slaat nergens op
1200.576	4.143326295454818	PVV/Wilders/left/positive/Vegetarianism	142	PVV_Wilders.jpg	Eet groenten, bescherm het milieu
1208.916	4.343233648268343	GL/Klaver/right/positive/Vegetarianism	40	GL_Klaver.jpg	Eet vlees voor een gezond dieet
1213.052	3.8533276095771765	GL/Klaver/right/positive/Climate	35	GL_Klaver.jpg	Warmer klimaat, warmere stranden
1217.124	4.145419288801163	PVV/Wilders/left/positive/Immigration	140	PVV_Wilders.jpg	Een warm welkom voor vluchtelingen
1220.992	3.85000968656184	GL/Klaver/right/neutral/Integration	27	GL_Klaver.jpg	Samenleving verbrokkelt, culturen botsen
1224.428	3.468306605189924	GL/Timmermans/right/neutral/Integration	63	GL_Timmermans.jpg	Stop multiculturalisme
1228.532	4.038128650379418	GL/Timmermans/left/positive/Immigration	68	GL_Timmermans.jpg	Een warm welkom voor vluchtelingen
1236.52	3.989338941076143	GL/Klaver/left/negative/Climate	5	GL_Klaver.jpg	Klimaatverandering neemt onze toekomst weg
1240.492	4.032881405374804	GL/Timmermans/right/neutral/Immigration	62	GL_Timmermans.jpg	Stop immigranten aan de grens
1248.512	4.099526125475697	PVV/Agema/left/neutral/Gender equality	91	PVV_Agema.jpg	Meer vrouwen aan de macht
1253.252	4.64410117863571	GL/Klaver/left/negative/EU	6	GL_Klaver.jpg	Blijf bij de Unie, of verzwak door oorlog
1261.256	4.128806513610004	GL/Klaver/left/positive/Integration	33	GL_Klaver.jpg	Bevorder begrip, koester cultureel verschil
1265.16	4.032881405374804	GL/Timmermans/right/neutral/Immigration	62	GL_Timmermans.jpg	Stop immigranten aan de grens
1269.044	3.8533276095771765	GL/Klaver/right/positive/Climate	35	GL_Klaver.jpg	Warmer klimaat, warmere stranden
1272.8	3.823513403607043	GL/Klaver/left/positive/Immigration	32	GL_Klaver.jpg	Bied vrede aan vluchtelingen
1281.256	4.381457850177664	GL/Timmermans/left/negative/EU	42	GL_Timmermans.jpg	Bezwijk niet voor oorlog, kies de EU
1285.624	4.538095802485606	GL/Timmermans/left/negative/Climate	41	GL_Timmermans.jpg	Onze kinderen hebben geen toekomst, stop klimaatverandering
1289.66	4.038943826005855	PVV/Wilders/left/negative/Climate	113	PVV_Wilders.jpg	Klimaatverandering neemt onze toekomst weg
1294.116	4.499286787725835	PVV/Agema/left/negative/Climate	77	PVV_Agema.jpg	Stop klimaatverandering voordat het te laat is
1298.4	4.032881405374804	GL/Timmermans/right/neutral/Immigration	62	GL_Timmermans.jpg	Stop immigranten aan de grens
1306.608	4.163485871573664	GL/Klaver/left/negative/Immigration	8	GL_Klaver.jpg	Alle vluchtelingen hebben recht op bescherming
1310.344	3.742021417591615	PVV/Agema/left/neutral/EU	90	PVV_Agema.jpg	Versterk de Europese basis
1318.5	3.7502428358416666	PVV/Wilders/left/negative/Immigration	116	PVV_Wilders.jpg	Stop onrecht tegen vluchtelingen
1322.688	3.742021417591615	PVV/Agema/left/neutral/EU	90	PVV_Agema.jpg	Versterk de Europese basis
1326.892	4.256936465724646	PVV/Agema/left/positive/EU	102	PVV_Agema.jpg	Europa zorgt voor vrede in Europa
1330.692	3.8122525534751173	GL/Timmermans/right/negative/Immigration	50	GL_Timmermans.jpg	Deporteer nu alle immigranten
1338.832	4.133467370252111	GL/Timmermans/left/positive/Integration	69	GL_Timmermans.jpg	Vier diversiteit, laat harmonie opbloeien
1347.172	4.275646012877995	PVV/Agema/right/negative/Gender equality	85	PVV_Agema.jpg	Stop bedreigingen tegen het traditionele gezin
1351.244	4.275646012877995	PVV/Agema/right/negative/Gender equality	85	PVV_Agema.jpg	Stop bedreigingen tegen het traditionele gezin
1355.164	3.7813636106267823	PVV/Agema/left/positive/Integration	105	PVV_Agema.jpg	Multiculti maakt ons sterker
